<?xml version="1.0" encoding="UTF-8"?>
<xs:schema xmlns:xs="http://www.w3.org/2001/XMLSchema">
	<xs:element name="method">
		<xs:complexType>
			<xs:sequence>
				<xs:element name="parameters" minOccurs="0" maxOccurs="unbounded">
					<xs:complexType>
						<xs:sequence>
							<xs:element name="parameter" type="xs:string" minOccurs="0"
								maxOccurs="unbounded" />
						</xs:sequence>
						<xs:attribute name="name" type="xs:string" />
					</xs:complexType>
				</xs:element>
			</xs:sequence>
			<xs:attribute name="name" type="xs:string" />
		</xs:complexType>
	</xs:element>
</xs:schema>
